{
  "$schema": "./blueprint-schema.json",
  "preferredVersions": {
    "php": "8.3",
    "moodle": "5.3"
  },
  "runtime": {
    "debug": 0,
    "debugdisplay": 0
  },
  "landingPage": "/",
  "constants": {
    "ADMIN_USER": "admin",
    "ADMIN_PASS": "password",
    "ADMIN_EMAIL": "admin@example.com"
  },
  "steps": [
    {
      "step": "installMoodle",
      "options": {
        "adminUser": "{{ADMIN_USER}}",
        "adminPass": "{{ADMIN_PASS}}",
        "adminEmail": "{{ADMIN_EMAIL}}",
        "siteName": "Moodle Playground",
        "locale": "en",
        "timezone": "UTC"
      }
    },
    {
      "step": "login",
      "username": "{{ADMIN_USER}}"
    },
    {
      "step": "createCategory",
      "name": "Playground Courses"
    },
    {
      "step": "createCourse",
      "fullname": "Getting Started",
      "shortname": "PLAY101",
      "category": "Playground Courses",
      "summary": "Welcome to Moodle Playground! This starter course is a sandbox for you to explore Moodle features — add activities, upload resources, and experiment freely. Everything resets when you close the tab."
    },
    {
      "step": "enrolUser",
      "username": "{{ADMIN_USER}}",
      "course": "PLAY101",
      "role": "editingteacher"
    },
    {
      "step": "setLandingPage",
      "path": "/"
    }
  ]
}
